{
  "best_for": "Modern Vue 3 applications with Composition API and progressive enhancement features",
  "category": "ssg_template_business_service",
  "complexity_level": "medium_to_high",
  "hosting_pattern": "aws_optimized",
  "key_features": [
    "vue_3_composition_api",
    "progressive_enhancement",
    "pinia_state_management",
    "modern_patterns",
    "vue_ecosystem"
  ],
  "last_updated": "2025-10-13T08:50:30.595139+00:00",
  "monthly_cost_range": [
    0,
    0
  ],
  "performance_tier": "optimized",
  "schema_version": "1.0.0",
  "setup_cost_range": [
    0,
    0
  ],
  "ssg_engine": "nuxt",
  "stack_type": "nuxt_template",
  "target_market": [],
  "template_variants": [
    "vue_business",
    "content_site",
    "vue_portfolio"
  ],
  "tier_name": "Nuxt Template - Vue Ecosystem with Modern Patterns"
}