{
  "best_for": "Sites requiring both professional content management and e-commerce capabilities with unified orchestration",
  "category": "composed_service",
  "complexity_level": "high",
  "hosting_pattern": "aws_optimized",
  "key_features": [
    "unified_content_commerce",
    "cross_domain_events",
    "shared_user_management",
    "integrated_analytics"
  ],
  "last_updated": "2025-10-13T08:50:30.595139+00:00",
  "monthly_cost_range": [
    0,
    0
  ],
  "performance_tier": "enterprise",
  "provider_combinations": "flexible",
  "schema_version": "1.0.0",
  "setup_cost_range": [
    0,
    0
  ],
  "ssg_engine_options": [
    "astro",
    "gatsby",
    "nextjs"
  ],
  "stack_type": "cms_ecommerce_composed",
  "target_market": [],
  "template_variants": [
    "content_store",
    "editorial_commerce",
    "magazine_shop"
  ],
  "tier_name": "Composed CMS + E-commerce Stack"
}