{
  "best_for": "Enterprise-ready React applications with static export and full-stack growth path",
  "category": "ssg_template_business_service",
  "complexity_level": "high",
  "hosting_pattern": "aws_optimized",
  "key_features": [
    "enterprise_patterns",
    "typescript_first",
    "api_routes_ready",
    "static_export",
    "full_stack_growth"
  ],
  "last_updated": "2025-10-11T11:11:45.081160+00:00",
  "monthly_cost_range": [
    85,
    115
  ],
  "performance_tier": "enterprise",
  "schema_version": "1.0.0",
  "setup_cost_range": [
    1440,
    3360
  ],
  "ssg_engine": "nextjs",
  "stack_type": "nextjs_template",
  "target_market": [
    "fullstack_developers",
    "enterprise_teams",
    "business_applications",
    "scalable_architecture"
  ],
  "template_variants": [
    "business_app",
    "marketing_site",
    "saas_landing"
  ],
  "tier_name": "Next.js Template - Enterprise Full-Stack React Foundation"
}