{
  "best_for": "React-based static sites with GraphQL data layer and component architecture",
  "category": "ssg_template_business_service",
  "complexity_level": "medium_to_high",
  "hosting_pattern": "aws_optimized",
  "key_features": [
    "react_components",
    "graphql_data_layer",
    "plugin_ecosystem",
    "image_optimization",
    "component_reusability"
  ],
  "last_updated": "2025-10-13T08:50:30.595139+00:00",
  "monthly_cost_range": [
    0,
    0
  ],
  "performance_tier": "optimized",
  "schema_version": "1.0.0",
  "setup_cost_range": [
    0,
    0
  ],
  "ssg_engine": "gatsby",
  "stack_type": "gatsby_template",
  "target_market": [],
  "template_variants": [
    "react_business",
    "content_blog",
    "portfolio_showcase"
  ],
  "tier_name": "Gatsby Template - React Ecosystem with GraphQL"
}