{
  "best_for": "Modern sites requiring interactive features with optimal performance",
  "category": "foundation_ssg_service",
  "complexity_level": "medium_to_high",
  "hosting_pattern": "aws_optimized",
  "key_features": [
    "component_islands",
    "partial_hydration",
    "framework_agnostic",
    "performance_optimized"
  ],
  "last_updated": "2025-10-13T08:50:30.595139+00:00",
  "monthly_cost_range": [
    0,
    0
  ],
  "performance_tier": "premium",
  "schema_version": "1.0.0",
  "setup_cost_range": [
    0,
    0
  ],
  "ssg_engine": "astro",
  "stack_type": "modern_performance",
  "target_market": [],
  "template_variants": [
    "modern_interactive",
    "component_islands",
    "performance_optimized"
  ],
  "tier_name": "Modern High-Performance Interactive"
}